ID,Username,ProfileURL,Title,Rating,Review Text,Review Content,Review URL,Date,Format,Verified,Helpful,Thumbnails,Images,Video,Scraped At,Heater,Price,English,Title1,Review1,sentiment_score_Rev,sentiment_score_Title
R2YIB8T4GVI1Y0,Gaaaaaaaaaard,https://www.amazon.com/gp/profile/amzn1.account.AFSVDRIXDDCKS7C2EWSWAAQDGX4A/ref=cm_cr_getr_d_gw_btm?ie=UTF8,Tip sensor failed —> RESOLVED,5,5.0 out of 5 stars,"Updated review (see original below) - So the tip over sensor in my heater failed in the “on” position, so the fan would stay on even if tipped. It got progressively worse after my original review and ended up melting part of the assembly on the inside that the tip sensor wires plugged into. I cut the wires and bypassed the tip sensor altogether. I STRONGLY recommend against doing this!! My heater is being used to heat a small greenhouse and poses almost no fire risk and even if it did start a fire, it would be sequestered to a safe area. That being said, I strongly believe that the malfunction I had was a fluke and not something that in and of itself could have caused a fire. Otherwise, this is a fantastic little forced air heater. FWIW, if you’re handy, it wouldn’t be difficult at all to upgrade the fan inside of it to a stronger/better fan since it’s a computer sized fan, do that at your own risk though. Despite my issue, I still liked this heater enough to originally give it three stars. I’m changing it to five because of the customer service. I never reached out to them because I assumed it would go the way most other negative Amazon experiences tend to go and I ultimately had a working fan. However, iSiler reached out to me to offer me a full refund of the product with a genuine apology. It didn’t feel too much like a cookie cutter response and they aren’t making me jump through hoops to receive the refund. The fact they went out of their way to get me my money back says an enormous amount about the business, and I’ll 100% buy any products they carry that I need from them in the future if they have it.——original review——Pretty okay little heater for the cost. It seems to be about average in noise production, but I think it stands out from the rest in its class aesthetically. My only problem with it is that the little button on the bottom failed in the “fan on” position. Not the button itself, it still moves up and down, but the fan doesn’t turn off.",https://www.amazon.com/gp/customer-reviews/R2YIB8T4GVI1Y0/ref=cm_cr_getr_d_rvw_ttl?ie=UTF8&ASIN=B0B28T4XWV,17-Jan-24,Color: Green,Verified Purchase,3 people found this helpful,,,,2025-06-03T15:32:04.402Z,5,39.99,0,Tip sensor failed —> RESOLVED,"Updated review (see original below) - So the tip over sensor in my heater failed in the “on” position, so the fan would stay on even if tipped. It got progressively worse after my original review and ended up melting part of the assembly on the inside that the tip sensor wires plugged into. I cut the wires and bypassed the tip sensor altogether. I STRONGLY recommend against doing this!! My heater is being used to heat a small greenhouse and poses almost no fire risk and even if it did start a fire, it would be sequestered to a safe area. That being said, I strongly believe that the malfunction I had was a fluke and not something that in and of itself could have caused a fire. Otherwise, this is a fantastic little forced air heater. FWIW, if you’re handy, it wouldn’t be difficult at all to upgrade the fan inside of it to a stronger/better fan since it’s a computer sized fan, do that at your own risk though. Despite my issue, I still liked this heater enough to originally give it three stars. I’m changing it to five because of the customer service. I never reached out to them because I assumed it would go the way most other negative Amazon experiences tend to go and I ultimately had a working fan. However, iSiler reached out to me to offer me a full refund of the product with a genuine apology. It didn’t feel too much like a cookie cutter response and they aren’t making me jump through hoops to receive the refund. The fact they went out of their way to get me my money back says an enormous amount about the business, and I’ll 100% buy any products they carry that I need from them in the future if they have it.——original review——Pretty okay little heater for the cost. It seems to be about average in noise production, but I think it stands out from the rest in its class aesthetically. My only problem with it is that the little button on the bottom failed in the “fan on” position. Not the button itself, it still moves up and down, but the fan doesn’t turn off.",-0.3247,-0.2185
R2ZWHY519COKIZ,Sandra Gill,https://www.amazon.com/gp/profile/amzn1.account.AH4DDUF6BW2O5OBUB7SYOOW4WCYQ/ref=cm_cr_getr_d_gw_btm?ie=UTF8,This easily portable heater quickly warms a room.,4,4.0 out of 5 stars,"I need to save money on my home heating.  It makes sense to limit heat to the room I’ll occupy for an hour or so- hence, a room heater.  This Isiler 1500 watt heated my 10x15’ room within 30 mins. It shuts down (not off) when you lift it.  The bottom gets warm so I’m going to rest it on a wooden surface if I raise it off the floor/carpet.  It makes a low humming sound while running.  Turning the back knob regulates the heat - adding temperature markers would be helpful.  Tho I‘ve had this item less than 24 hours, I’m satisfied I purchased it.",https://www.amazon.com/gp/customer-reviews/R2ZWHY519COKIZ/ref=cm_cr_getr_d_rvw_ttl?ie=UTF8&ASIN=B0B28T4XWV,16-Jan-24,,Verified Purchase,One person found this helpful,,,,2025-06-03T15:32:04.403Z,5,39.99,0,This easily portable heater quickly warms a room.,"I need to save money on my home heating.  It makes sense to limit heat to the room I’ll occupy for an hour or so- hence, a room heater.  This Isiler 1500 watt heated my 10x15’ room within 30 mins. It shuts down (not off) when you lift it.  The bottom gets warm so I’m going to rest it on a wooden surface if I raise it off the floor/carpet.  It makes a low humming sound while running.  Turning the back knob regulates the heat - adding temperature markers would be helpful.  Tho I‘ve had this item less than 24 hours, I’m satisfied I purchased it.",0.8225,0.5423
R1NIP0274LOS09,Jon,https://www.amazon.com/gp/profile/amzn1.account.AG7MTZD55NYHO76KQXKCFFI6E6WQ/ref=cm_cr_getr_d_gw_btm?ie=UTF8,Burned after a month,1,1.0 out of 5 stars,The heater burned out after a month.,https://www.amazon.com/gp/customer-reviews/R1NIP0274LOS09/ref=cm_cr_getr_d_rvw_ttl?ie=UTF8&ASIN=B0B28T4XWV,16-Jan-24,Color: Green,Verified Purchase,2 people found this helpful,,,,2025-06-03T15:32:04.404Z,5,39.99,0,Burned after a month,The heater burned out after a month.,0,0
RNOVEADESVOXS,Diane Blandford,https://www.amazon.com/gp/profile/amzn1.account.AGJYPPM4IXZSV26YMRK26DXT3RBQ/ref=cm_cr_getr_d_gw_btm?ie=UTF8,Garage??? No Way,1,1.0 out of 5 stars,This might heat a very small garage big enough for a mini-cooper.The seller's return guidelines and rules for this product are a big hassle.,https://www.amazon.com/gp/customer-reviews/RNOVEADESVOXS/ref=cm_cr_getr_d_rvw_ttl?ie=UTF8&ASIN=B0B28T4XWV,16-Jan-24,Color: Green,Verified Purchase,3 people found this helpful,,,,2025-06-03T15:32:04.405Z,5,39.99,0,Garage??? No Way,This might heat a very small garage big enough for a mini-cooper.The seller's return guidelines and rules for this product are a big hassle.,0,-0.4098
R3L6GVVLMMRLYO,Maidy,https://www.amazon.com/gp/profile/amzn1.account.AHKSN5IW67NZOHOUJRVTJLRXWEQQ/ref=cm_cr_getr_d_gw_btm?ie=UTF8,Sucker and a Quitter,2,2.0 out of 5 stars,"Initially I loved this little heater.  Small unit to heat up the freezing bathroom in the dead of winter and it blew a ton of heat quickly.  I was also looking for a unit that was NOT digital so that it might last longer.  I sucked a ton of electricity.  I could only turn on one lamp in the room without blowing the circuit.  Usually wasn't too much of an issue since I was just heating one small space for a short period of time.  Then, it totally died after only 2 seasons.",https://www.amazon.com/gp/customer-reviews/R3L6GVVLMMRLYO/ref=cm_cr_getr_d_rvw_ttl?ie=UTF8&ASIN=B0B28T4XWV,15-Jan-24,,Verified Purchase,,,,,2025-06-03T15:32:04.405Z,5,39.99,0,Sucker and a Quitter,"Initially I loved this little heater.  Small unit to heat up the freezing bathroom in the dead of winter and it blew a ton of heat quickly.  I was also looking for a unit that was NOT digital so that it might last longer.  I sucked a ton of electricity.  I could only turn on one lamp in the room without blowing the circuit.  Usually wasn't too much of an issue since I was just heating one small space for a short period of time.  Then, it totally died after only 2 seasons.",-0.8268,-0.5267
R3PY4LQF3FQG9F,Miles kenney,https://www.amazon.com/gp/profile/amzn1.account.AFI5OH2JUS65WBGDOYHC7BVT5GDQ/ref=cm_cr_getr_d_gw_btm?ie=UTF8,ON/OFF switch,4,4.0 out of 5 stars,"Almost ordered a second one today when my first one decided to quit running. The only off switch, like other people in the reviews are saying melted and will no longer turn the heater on or off. Contemplated changing the switch but I believe it wouldn't last very long again. Undersized wiring maybe? I'm not a electrical engineer, but the days seem to be numbered on how long the switch lasts.",https://www.amazon.com/gp/customer-reviews/R3PY4LQF3FQG9F/ref=cm_cr_getr_d_rvw_ttl?ie=UTF8&ASIN=B0B28T4XWV,15-Jan-24,,Verified Purchase,,,,,2025-06-03T15:32:04.405Z,5,39.99,0,ON/OFF switch,"Almost ordered a second one today when my first one decided to quit running. The only off switch, like other people in the reviews are saying melted and will no longer turn the heater on or off. Contemplated changing the switch but I believe it wouldn't last very long again. Undersized wiring maybe? I'm not a electrical engineer, but the days seem to be numbered on how long the switch lasts.",0.0387,0
R2Q5LHENL3JXQY,Beatrice M Machado,https://www.amazon.com/gp/profile/amzn1.account.AED6MT6RR4JAJHVBUAP4OKNHSDKA/ref=cm_cr_getr_d_gw_btm?ie=UTF8,Great buy,5,5.0 out of 5 stars,"This little heater is small but powerful,  perfect fir my garage",https://www.amazon.com/gp/customer-reviews/R2Q5LHENL3JXQY/ref=cm_cr_getr_d_rvw_ttl?ie=UTF8&ASIN=B0B28T4XWV,15-Jan-24,,Verified Purchase,,,,,2025-06-03T15:32:04.408Z,5,39.99,0,Great buy,"This little heater is small but powerful,  perfect fir my garage",0.8674,0.6249
R1O7RWO4G0SJTS,osuushi,https://www.amazon.com/gp/profile/amzn1.account.AEPCXRFU2XU2U46QEHJBAJF5CJBA/ref=cm_cr_getr_d_gw_btm?ie=UTF8,"Cute, warm, but loud",3,3.0 out of 5 stars,"I like the way this thing looks, and it’s certainly effective at heating the room, but it’s the loudest space heater I’ve ever owned. It’s clearly got a very small fan running at high speed.Mind you, it’s not deafening or anything, but I generally expect a space heater to be essentially silent from across the room. My watch picks up about 53 dB from 10 feet away, compared to my room’s 40 dB background noise. It’s also loud enough to notice over the background noise I sleep with at night.",https://www.amazon.com/gp/customer-reviews/R1O7RWO4G0SJTS/ref=cm_cr_getr_d_rvw_ttl?ie=UTF8&ASIN=B0B28T4XWV,14-Jan-24,Color: Green,Verified Purchase,,,,,2025-06-03T15:32:04.411Z,5,39.99,0,"Cute, warm, but loud","I like the way this thing looks, and it’s certainly effective at heating the room, but it’s the loudest space heater I’ve ever owned. It’s clearly got a very small fan running at high speed.Mind you, it’s not deafening or anything, but I generally expect a space heater to be essentially silent from across the room. My watch picks up about 53 dB from 10 feet away, compared to my room’s 40 dB background noise. It’s also loud enough to notice over the background noise I sleep with at night.",0.9144,0.3506
R1X1FDH6V1189Z,mark nickens,https://www.amazon.com/gp/profile/amzn1.account.AHO3WNGJBSD3EPVH2BWOMNZEM7CQ/ref=cm_cr_getr_d_gw_btm?ie=UTF8,Redesigned heater is loud and unsafe,2,2.0 out of 5 stars,"I purchased three previous models of this heater, and they were the best heaters I have ever purchased.  But Isiler redesigned the heater in these two irritating ways:  (1) The previous model only emitted a low whirring sound with the fan motor.  This new model emits a high-pitched sound in addition to the whirrling sound.  (2) The previous model included two small feet in the front that raised the heater so that air could get underneath it, so the surface where it sat did not get hot.  This new model removed the two feet so the heater rests solely on the surface where it sits.  This is undesirable, and I have to place something metal in the front of the new heaters so the bottom can breathe.  I will not buy another of these new models and will try to find old models.",https://www.amazon.com/gp/customer-reviews/R1X1FDH6V1189Z/ref=cm_cr_getr_d_rvw_ttl?ie=UTF8&ASIN=B0B28T4XWV,13-Jan-24,,Verified Purchase,,,,,2025-06-03T15:32:04.412Z,5,39.99,0,Redesigned heater is loud and unsafe,"I purchased three previous models of this heater, and they were the best heaters I have ever purchased.  But Isiler redesigned the heater in these two irritating ways:  (1) The previous model only emitted a low whirring sound with the fan motor.  This new model emits a high-pitched sound in addition to the whirrling sound.  (2) The previous model included two small feet in the front that raised the heater so that air could get underneath it, so the surface where it sat did not get hot.  This new model removed the two feet so the heater rests solely on the surface where it sits.  This is undesirable, and I have to place something metal in the front of the new heaters so the bottom can breathe.  I will not buy another of these new models and will try to find old models.",-0.714,0
R3QF7O0KY9ETNS,Amazon CustomerAmazon Customer,https://www.amazon.com/gp/profile/amzn1.account.AHY3KFQPZTSRKRNMKHXMBL6HLM5Q/ref=cm_cr_getr_d_gw_btm?ie=UTF8,Excellent space heater,5,5.0 out of 5 stars,"I ordered the iSiLER small mint green colored space heater from Amazon - it is perfect!! I use it to heat the kitchen while I’m prepping food, to keep me warm on the floor doing yoga, and sometimes while watching TV or reading in the evening. It’s so warm I can usually heat the space in a few minutes - especially if I’m moving around.The design is modern and streamlined - looks great in my house… The housing stays cool so if you touch the sides, top, bottom, you don’t get burned. The automatic cut-off works well - stops if it is tipped or knocked over.This heater is a great value. I highly recommend it!!",https://www.amazon.com/gp/customer-reviews/R3QF7O0KY9ETNS/ref=cm_cr_getr_d_rvw_ttl?ie=UTF8&ASIN=B0B28T4XWV,11-Jan-24,Color: Green,Verified Purchase,One person found this helpful,https://m.media-amazon.com/images/I/71fRBWGCpvL._SY88.jpg,https://m.media-amazon.com/images/I/71fRBWGCpvL.jpg,,2025-06-03T15:32:04.414Z,5,39.99,0,Excellent space heater,"I ordered the iSiLER small mint green colored space heater from Amazon - it is perfect!! I use it to heat the kitchen while I’m prepping food, to keep me warm on the floor doing yoga, and sometimes while watching TV or reading in the evening. It’s so warm I can usually heat the space in a few minutes - especially if I’m moving around.The design is modern and streamlined - looks great in my house… The housing stays cool so if you touch the sides, top, bottom, you don’t get burned. The automatic cut-off works well - stops if it is tipped or knocked over.This heater is a great value. I highly recommend it!!",0.9798,0.5719
R1FQILBD2MKI70,Jacel Bolo,https://www.amazon.com/gp/profile/amzn1.account.AGZ7UYHB24QU7F3274PWYU4CC4ZQ/ref=cm_cr_getr_d_gw_btm?ie=UTF8,I want to love this but I cant,1,1.0 out of 5 stars,"Product is so cute but the way it was made, this does not serve its purpose. Not enough power for heat but love the safety feature of it stopping when you hold it in a certain position.",https://www.amazon.com/gp/customer-reviews/R1FQILBD2MKI70/ref=cm_cr_getr_d_rvw_ttl?ie=UTF8&ASIN=B09GZ96K1N,2-Feb-25,Size: 5 Inches HighColor: Forest Green,Verified Purchase,,,,,2025-06-03T15:32:26.828Z,6,31.99,0,I want to love this but I cant,"Product is so cute but the way it was made, this does not serve its purpose. Not enough power for heat but love the safety feature of it stopping when you hold it in a certain position.",0.9285,0.4118
R47D1DWI17SQV,Jo Campbell,https://www.amazon.com/gp/profile/amzn1.account.AEBC5DTWLCRAJ2QJ5CQCONG6MWIA/ref=cm_cr_getr_d_gw_btm?ie=UTF8,It puts out a lot of heat.,5,5.0 out of 5 stars,It's an amazing little heater with excellent safety features. I was surprised at the amount of heat this little unit can produce. It is great for small spaces.,https://www.amazon.com/gp/customer-reviews/R47D1DWI17SQV/ref=cm_cr_getr_d_rvw_ttl?ie=UTF8&ASIN=B09GZ96K1N,10-Dec-24,Size: 5 Inches HighColor: Forest Green,Verified Purchase,,,,,2025-06-03T15:32:26.829Z,6,31.99,0,It puts out a lot of heat.,It's an amazing little heater with excellent safety features. I was surprised at the amount of heat this little unit can produce. It is great for small spaces.,0.9436,0
R2JKTB323ZSDWB,alex desantiago,https://www.amazon.com/gp/profile/amzn1.account.AH2IF7IVEUNXEXHGDHUI4XNJORQQ/ref=cm_cr_getr_d_gw_btm?ie=UTF8,Great,5,5.0 out of 5 stars,Great,https://www.amazon.com/gp/customer-reviews/R2JKTB323ZSDWB/ref=cm_cr_getr_d_rvw_ttl?ie=UTF8&ASIN=B09GZ96K1N,16-Nov-24,,Verified Purchase,,,,,2025-06-03T15:32:26.830Z,6,31.99,0,Great,Great,0.6249,0.6249
R2WR6M6CC81VBD,Rene Temrowski,https://www.amazon.com/gp/profile/amzn1.account.AFSPAYPC4MZP4636LIDDFDKQJE5Q/ref=cm_cr_getr_d_gw_btm?ie=UTF8,It works jus need new parts,1,1.0 out of 5 stars,I lost the legs and need new ones,https://www.amazon.com/gp/customer-reviews/R2WR6M6CC81VBD/ref=cm_cr_getr_d_rvw_ttl?ie=UTF8&ASIN=B09GZ96K1N,14-Nov-24,Size: 5 Inches HighColor: Forest Green,Verified Purchase,,,,,2025-06-03T15:32:26.831Z,6,31.99,0,It works jus need new parts,I lost the legs and need new ones,-0.3182,0
R3EGD4HWK9YR4W,Jill,https://www.amazon.com/gp/profile/amzn1.account.AHKEWTK65SBDRYVWHEEUA4FZ42PA/ref=cm_cr_getr_d_gw_btm?ie=UTF8,Love it,5,5.0 out of 5 stars,Perfect for under my desk in a freezing office. And cute!,https://www.amazon.com/gp/customer-reviews/R3EGD4HWK9YR4W/ref=cm_cr_getr_d_rvw_ttl?ie=UTF8&ASIN=B09GZ96K1N,10-Nov-24,Size: 5 Inches HighColor: Forest Green,Verified Purchase,,,,,2025-06-03T15:32:26.832Z,6,31.99,0,Love it,Perfect for under my desk in a freezing office. And cute!,0.7644,0.6369
RYDLJPZFNX2H1,daveooo,https://www.amazon.com/gp/profile/amzn1.account.AEWPD2SYYZXDNSO2MO4IYNE6GTDQ/ref=cm_cr_getr_d_gw_btm?ie=UTF8,Compact and powerful.,5,5.0 out of 5 stars,Used in bathroom and it heats up the room in no time. Powerful unit. Will buy one for living room.,https://www.amazon.com/gp/customer-reviews/RYDLJPZFNX2H1/ref=cm_cr_getr_d_rvw_ttl?ie=UTF8&ASIN=B09GZ96K1N,9-Nov-24,Size: 5 Inches HighColor: Forest Green,Verified Purchase,,,,,2025-06-03T15:32:26.833Z,6,31.99,0,Compact and powerful.,Used in bathroom and it heats up the room in no time. Powerful unit. Will buy one for living room.,-0.5472,0.4215
R3DJSOZTC9IMK5,JavierJavier,https://www.amazon.com/gp/profile/amzn1.account.AHVADVSZPRVEY7U52ZVJZJALLAZA/ref=cm_cr_getr_d_gw_btm?ie=UTF8,Nice looking heater,5,5.0 out of 5 stars,"Very powerful and fits in my desk.  Great for the coming cold weather, very silent fan.",https://www.amazon.com/gp/customer-reviews/R3DJSOZTC9IMK5/ref=cm_cr_getr_d_rvw_ttl?ie=UTF8&ASIN=B09GZ96K1N,8-Nov-24,Size: 5 Inches HighColor: Forest Green,Verified Purchase,,https://m.media-amazon.com/images/I/511L9bxxFUL._SY88.jpg,https://m.media-amazon.com/images/I/511L9bxxFUL.jpg,,2025-06-03T15:32:26.834Z,6,31.99,0,Nice looking heater,"Very powerful and fits in my desk.  Great for the coming cold weather, very silent fan.",0.868,0.4215
R168SD94TE3GGO,PAT,https://www.amazon.com/gp/profile/amzn1.account.AGH2EQMTJZVDZ4R2TRDJRDZGOIVA/ref=cm_cr_getr_d_gw_btm?ie=UTF8,perfect!,5,5.0 out of 5 stars,LOVE this little powerful heater !  Love the color - says forest green but more teal - which is exactly what I wanted.  This heats up my whole bathroom in just a few minutes.  LOVE IT  !!  Looks like a little vintage radio - so darn cute.,https://www.amazon.com/gp/customer-reviews/R168SD94TE3GGO/ref=cm_cr_getr_d_rvw_ttl?ie=UTF8&ASIN=B09GZ96K1N,7-Nov-24,Size: 5 Inches HighColor: Forest Green,Verified Purchase,,,,,2025-06-03T15:32:26.835Z,6,31.99,0,perfect!,LOVE this little powerful heater !  Love the color - says forest green but more teal - which is exactly what I wanted.  This heats up my whole bathroom in just a few minutes.  LOVE IT  !!  Looks like a little vintage radio - so darn cute.,0.9743,0.6114
R3QJZ4CANN7HCJ,Mario Wilson,https://www.amazon.com/gp/profile/amzn1.account.AHPRTKIZJSCQ2NY2BRVUBBYDY3SQ/ref=cm_cr_getr_d_gw_btm?ie=UTF8,Works perfect.,5,5.0 out of 5 stars,It sets on my desk. Keeps me warm while working.,https://www.amazon.com/gp/customer-reviews/R3QJZ4CANN7HCJ/ref=cm_cr_getr_d_rvw_ttl?ie=UTF8&ASIN=B09GZ96K1N,7-Nov-24,Size: 5 Inches HighColor: Forest Green,Verified Purchase,,,,,2025-06-03T15:32:26.836Z,6,31.99,0,Works perfect.,It sets on my desk. Keeps me warm while working.,0.2263,0.5719
R312I7Y8I03KK,cassie kuzan,https://www.amazon.com/gp/profile/amzn1.account.AGZPIHWXH7ZHPT2C7ZIJQDECIWOQ/ref=cm_cr_getr_d_gw_btm?ie=UTF8,the cool feature tho!,5,5.0 out of 5 stars,cute heater that works well! the auto shut off if knocked over is a must for in the office! no one is talking about the cool blow feature it has! that is unique! luv it!,https://www.amazon.com/gp/customer-reviews/R312I7Y8I03KK/ref=cm_cr_getr_d_rvw_ttl?ie=UTF8&ASIN=B09GZ96K1N,4-Nov-24,Size: 5 Inches HighColor: Forest Green,Verified Purchase,,,,,2025-06-03T15:32:26.837Z,6,31.99,0,the cool feature tho!,cute heater that works well! the auto shut off if knocked over is a must for in the office! no one is talking about the cool blow feature it has! that is unique! luv it!,0.7482,0.3802
R2FPZUN5VUJY8F,RosaRosa,https://www.amazon.com/gp/profile/amzn1.account.AER22BDBV6ZKWRAFXA3AHGQBANWA/ref=cm_cr_getr_d_gw_btm?ie=UTF8,Great product,5,5.0 out of 5 stars,"Worth the money, even though it’s small the heat is great.  The best part is that gives a really nice touch to the whole room.  Works great. It heats really good, meaning you can actually feel the heat. Great gift for this weather.  Definitely recommend it.",https://www.amazon.com/gp/customer-reviews/R2FPZUN5VUJY8F/ref=cm_cr_getr_d_rvw_ttl?ie=UTF8&ASIN=B09GZ96K1N,30-Oct-24,Size: 5 Inches HighColor: Forest Green,Verified Purchase,,https://m.media-amazon.com/images/I/61gnw9TtrHL._SY88.jpg,https://m.media-amazon.com/images/I/61gnw9TtrHL.jpg,,2025-06-03T15:32:34.429Z,6,31.99,0,Great product,"Worth the money, even though it’s small the heat is great.  The best part is that gives a really nice touch to the whole room.  Works great. It heats really good, meaning you can actually feel the heat. Great gift for this weather.  Definitely recommend it.",0.9859,0.6249
R1LZO3XISZE3NN,Tabitha Weekes-BoylesTabitha Weekes-Boyles,https://www.amazon.com/gp/profile/amzn1.account.AFHSCF7IKPQQ6DGFM3QUY367KVTA/ref=cm_cr_getr_d_gw_btm?ie=UTF8,So cute 🩵,5,5.0 out of 5 stars,"First of all, this heater is absolutely adorable. It works really well and it's the perfect size for my little room. I love the auto shut off so I don't have to worry if it gets knocked over. It's super easy to use and the fan isn't very loud.Very cute and worth the money.",https://www.amazon.com/gp/customer-reviews/R1LZO3XISZE3NN/ref=cm_cr_getr_d_rvw_ttl?ie=UTF8&ASIN=B09GZ96K1N,28-Oct-24,Size: 5 Inches HighColor: Forest Green,Verified Purchase,,https://m.media-amazon.com/images/I/61v-V1AJbVL._SY88.jpg,https://m.media-amazon.com/images/I/61v-V1AJbVL.jpg,,2025-06-03T15:32:34.429Z,6,31.99,0,So cute 🩵,"First of all, this heater is absolutely adorable. It works really well and it's the perfect size for my little room. I love the auto shut off so I don't have to worry if it gets knocked over. It's super easy to use and the fan isn't very loud.Very cute and worth the money.",0.9727,0.5095
RCEFNE7N7BLHH,K.p.,https://www.amazon.com/gp/profile/amzn1.account.AHFA4RSA7XFVNMIVJ3HIZORHGWAA/ref=cm_cr_getr_d_gw_btm?ie=UTF8,"worked as a fan, not a heater!",2,2.0 out of 5 stars,"It came with a standard electrical plug and turned on.  It simply blew air, never heated up and used a great deal of electricity to do so.",https://www.amazon.com/gp/customer-reviews/RCEFNE7N7BLHH/ref=cm_cr_getr_d_rvw_ttl?ie=UTF8&ASIN=B09GZ96K1N,26-Oct-24,,Verified Purchase,,,,,2025-06-03T15:32:34.430Z,6,31.99,0,"worked as a fan, not a heater!","It came with a standard electrical plug and turned on.  It simply blew air, never heated up and used a great deal of electricity to do so.",0.6249,0.3802
