ID,Username,ProfileURL,Title,Rating,Review Text,Review Content,Review URL,Date,Format,Verified,Helpful,Thumbnails,Images,Video,Scraped At,Heater,Price,English,Title1,Review1,sentiment_score_Rev,sentiment_score_Title
RPII2AKYFY0F4,Manuel Sousa,https://www.amazon.com/gp/profile/amzn1.account.AE37KHRROBCKMHOQRFFT5CZ3NLWQ/ref=cm_cr_getr_d_gw_btm?ie=UTF8,Great Little Heater,5,5.0 out of 5 stars,I received this new heater so I can keep my water lines water and get frozen during a freeze cold weather at my water well tanks and filters.  It has work great so far.  Glad that I have this little heater.  The settings on it is great.,https://www.amazon.com/gp/customer-reviews/RPII2AKYFY0F4/ref=cm_cr_getr_d_rvw_ttl?ie=UTF8&ASIN=B07FFZRRB2,9-Feb-24,Color: White,Verified Purchase,,,,,2025-06-03T15:28:13.455Z,3,34.99,0,Great Little Heater,I received this new heater so I can keep my water lines water and get frozen during a freeze cold weather at my water well tanks and filters.  It has work great so far.  Glad that I have this little heater.  The settings on it is great.,0.9297,0.6249
R2ZDT16RYKPNQV,Aissata,https://www.amazon.com/gp/profile/amzn1.account.AF33KP5CE7FHW3HHAID2SE44T5ZA/ref=cm_cr_getr_d_gw_btm?ie=UTF8,Brown after 1 year of use,3,3.0 out of 5 stars,Great until it stopped working after a year of use,https://www.amazon.com/gp/customer-reviews/R2ZDT16RYKPNQV/ref=cm_cr_getr_d_rvw_ttl?ie=UTF8&ASIN=B07FFZRRB2,7-Feb-24,Color: Black,Verified Purchase,,,,,2025-06-03T15:28:13.456Z,3,34.99,0,Brown after 1 year of use,Great until it stopped working after a year of use,0.4939,0
RAZPN67ZA5HGS,Michael Allen,https://www.amazon.com/gp/profile/amzn1.account.AGDGETITCCWCMTGK477TL24A3LTQ/ref=cm_cr_getr_d_gw_btm?ie=UTF8,Lasted about 3 years,4,4.0 out of 5 stars,"I bought this unit April 2021 and have used it about 1/2 an hour ever day to warm my bathroom while in my shower.  Today, while in the shower, the heater shut off. Not sure what happened, it was level, nothing was near or around it, it just stopped. It was a great portable, easy to use unit till today. I will buy this one again. Just kinda disappointed it only lasted 3 years.",https://www.amazon.com/gp/customer-reviews/RAZPN67ZA5HGS/ref=cm_cr_getr_d_rvw_ttl?ie=UTF8&ASIN=B07FFZRRB2,6-Feb-24,Color: White,Verified Purchase,,,,,2025-06-03T15:28:13.456Z,3,34.99,0,Lasted about 3 years,"I bought this unit April 2021 and have used it about 1/2 an hour ever day to warm my bathroom while in my shower.  Today, while in the shower, the heater shut off. Not sure what happened, it was level, nothing was near or around it, it just stopped. It was a great portable, easy to use unit till today. I will buy this one again. Just kinda disappointed it only lasted 3 years.",0.4991,0
R1LRXWT26AC0MN,Placeholder,https://www.amazon.com/gp/profile/amzn1.account.AHOJTA3EWHTUMTKPWQJ7ALYLMJVQ/ref=cm_cr_getr_d_gw_btm?ie=UTF8,Fan speed control broke after two weeks,2,2.0 out of 5 stars,The heater itself gets hot to the touch and the fan speed doesn’t work(wonderful),https://www.amazon.com/gp/customer-reviews/R1LRXWT26AC0MN/ref=cm_cr_getr_d_rvw_ttl?ie=UTF8&ASIN=B07FFZRRB2,6-Feb-24,Color: White,Verified Purchase,,,,,2025-06-03T15:28:13.457Z,3,34.99,0,Fan speed control broke after two weeks,The heater itself gets hot to the touch and the fan speed doesn’t work(wonderful),0.3182,-0.128
R3EMYAIR0CEPU3,Arlingtonian,https://www.amazon.com/gp/profile/amzn1.account.AG3E6ZDXTRTFO42PWGSRMQR3JZSQ/ref=cm_cr_getr_d_gw_btm?ie=UTF8,Small and mighty,5,5.0 out of 5 stars,"I live in a small 1930s home - which means no insulation.  So I keep the thermostat at a reasonable temperature which is fine for the sunny side of the house - but the back side which gets little light is always cold.  And of course, that’s where my office (smaller bedroom) and bathroom are located.  I’ve had a small black space heater that sits in my office for years - but the cord is short and there’s no where to set it so that I could easily move it between spaces without unplugging it each use or using an extension cord - which I am not sure is safe.  So I got this one designed for wet spaces and in white with a longer cord that would reach the outlet in my teeny bathroom up by the light switches.  I am pleased with the simplicity and instant heat.",https://www.amazon.com/gp/customer-reviews/R3EMYAIR0CEPU3/ref=cm_cr_getr_d_rvw_ttl?ie=UTF8&ASIN=B07FFZRRB2,4-Feb-24,Color: White,Verified Purchase,,,,,2025-06-03T15:28:13.458Z,3,34.99,0,Small and mighty,"I live in a small 1930s home - which means no insulation.  So I keep the thermostat at a reasonable temperature which is fine for the sunny side of the house - but the back side which gets little light is always cold.  And of course, that’s where my office (smaller bedroom) and bathroom are located.  I’ve had a small black space heater that sits in my office for years - but the cord is short and there’s no where to set it so that I could easily move it between spaces without unplugging it each use or using an extension cord - which I am not sure is safe.  So I got this one designed for wet spaces and in white with a longer cord that would reach the outlet in my teeny bathroom up by the light switches.  I am pleased with the simplicity and instant heat.",0.1149,0
R2U4FC8XP62YGI,Mark Twain9,https://www.amazon.com/gp/profile/amzn1.account.AG6WBNZVXXFYOTF5VNREDX2VRZBA/ref=cm_cr_getr_d_gw_btm?ie=UTF8,way higher watts than it says,4,4.0 out of 5 stars,"Keeps me warm, but the 1500W setting is more like 3000w and sets off the surge protector. The 600w is more like 1000w and works ok.  Like most heaters, the fan is loud.",https://www.amazon.com/gp/customer-reviews/R2U4FC8XP62YGI/ref=cm_cr_getr_d_rvw_ttl?ie=UTF8&ASIN=B07FFZRRB2,3-Feb-24,Color: White,Verified Purchase,,,,,2025-06-03T15:28:22.470Z,3,34.99,0,way higher watts than it says,"Keeps me warm, but the 1500W setting is more like 3000w and sets off the surge protector. The 600w is more like 1000w and works ok.  Like most heaters, the fan is loud.",0.9374,0
R1S0QR4HLYN2W4,Lester,https://www.amazon.com/gp/profile/amzn1.account.AGXNQKW6PBK64ITGDHMMDWTPNUWQ/ref=cm_cr_getr_d_gw_btm?ie=UTF8,Almost perfect except for “high” setting,3,3.0 out of 5 stars,"This heater is a great size and does a good job at heating a small room. It blows out very gently and it’s pretty quiet. It’s nice being able to control the temp from low-high with the knob. However, I can only give it 3 stars because when it’s running on “high”, the temperature control knob gets dangerously hot. It heats up slowly but gets so hot I’m concerned about the plastic melting or burning my fingers. Now, this ONLY happens when it’s on high - low is fine. And high is fine for maybe 15-30 minutes before the knob starts to get hot. But if I’d noticed this earlier, I’d have returned the heater.",https://www.amazon.com/gp/customer-reviews/R1S0QR4HLYN2W4/ref=cm_cr_getr_d_rvw_ttl?ie=UTF8&ASIN=B07FFZRRB2,2-Feb-24,Color: White,Verified Purchase,One person found this helpful,,,,2025-06-03T15:28:22.471Z,3,34.99,0,Almost perfect except for “high” setting,"This heater is a great size and does a good job at heating a small room. It blows out very gently and it’s pretty quiet. It’s nice being able to control the temp from low-high with the knob. However, I can only give it 3 stars because when it’s running on “high”, the temperature control knob gets dangerously hot. It heats up slowly but gets so hot I’m concerned about the plastic melting or burning my fingers. Now, this ONLY happens when it’s on high - low is fine. And high is fine for maybe 15-30 minutes before the knob starts to get hot. But if I’d noticed this earlier, I’d have returned the heater.",0.8124,0.5279
R2IO5KK8WORFD8,jedediah heavy,https://www.amazon.com/gp/profile/amzn1.account.AEV32R5DZU5MVF6DMN6DRG663Y2A/ref=cm_cr_getr_d_gw_btm?ie=UTF8,Excellent bathroom heater,5,5.0 out of 5 stars,Love the heater. Works well in bathroom,https://www.amazon.com/gp/customer-reviews/R2IO5KK8WORFD8/ref=cm_cr_getr_d_rvw_ttl?ie=UTF8&ASIN=B07FFZRRB2,31-Jan-24,Color: White,Verified Purchase,One person found this helpful,,,,2025-06-03T15:28:22.471Z,3,34.99,0,Excellent bathroom heater,Love the heater. Works well in bathroom,0.743,0.5719
RKW5NMU8O524G,KS,https://www.amazon.com/gp/profile/amzn1.account.AEPKV5IGUDSYG3YEOR47XEEC5JEA/ref=cm_cr_getr_d_gw_btm?ie=UTF8,"Portable, Safe, great Heat source",5,5.0 out of 5 stars,I bought my first Pro Breeze in 2020 and carried it from room to room instead of heating the whole house. Pro Breeze has literally saved me hundreds of dollars in the meantime. I purchased a second Pro Breeze for convenience and love it. The safety feature switches heater off if tipped over. Highly recommend.,https://www.amazon.com/gp/customer-reviews/RKW5NMU8O524G/ref=cm_cr_getr_d_rvw_ttl?ie=UTF8&ASIN=B07FFZRRB2,31-Jan-24,Color: Black,Verified Purchase,,,,,2025-06-03T15:28:22.472Z,3,34.99,0,"Portable, Safe, great Heat source",I bought my first Pro Breeze in 2020 and carried it from room to room instead of heating the whole house. Pro Breeze has literally saved me hundreds of dollars in the meantime. I purchased a second Pro Breeze for convenience and love it. The safety feature switches heater off if tipped over. Highly recommend.,0.9117,0.7906
R39U5638GTVEQU,l.r.ramsey,https://www.amazon.com/gp/profile/amzn1.account.AFYUVSGYB3PFM6MV7ISEW6EJHMLQ/ref=cm_cr_getr_d_gw_btm?ie=UTF8,Small Heater,5,5.0 out of 5 stars,This heater works very well in my garage to take the chill out of the air and is not noisy like some other heaters.,https://www.amazon.com/gp/customer-reviews/R39U5638GTVEQU/ref=cm_cr_getr_d_rvw_ttl?ie=UTF8&ASIN=B07FFZRRB2,30-Jan-24,Color: White,Verified Purchase,,,,,2025-06-03T15:28:22.473Z,3,34.99,0,Small Heater,This heater works very well in my garage to take the chill out of the air and is not noisy like some other heaters.,0.2025,0
RDIVUUU1K76KD,Cinnamon,https://www.amazon.com/gp/profile/amzn1.account.AH5NDVXWLHJUGKIIAYAJLVEEMPCQ/ref=cm_cr_getr_d_gw_btm?ie=UTF8,Excellent in all aspects,5,5.0 out of 5 stars,"Not much not to like about this compact heater.  It's compact, quiet and throws out plenty of heat for its size.  I use it in both a motor home and also in a small home office.  It has two heat settings and also a fan only setting.",https://www.amazon.com/gp/customer-reviews/RDIVUUU1K76KD/ref=cm_cr_getr_d_rvw_ttl?ie=UTF8&ASIN=B07FFZRRB2,28-Jan-24,Color: Black,Verified Purchase,,,,,2025-06-03T15:28:22.474Z,3,34.99,0,Excellent in all aspects,"Not much not to like about this compact heater.  It's compact, quiet and throws out plenty of heat for its size.  I use it in both a motor home and also in a small home office.  It has two heat settings and also a fan only setting.",0.049,0.5719
R1ZEZLICDE1732,Robert H Casstevens,https://www.amazon.com/gp/profile/amzn1.account.AGCCWDTMHWY3D2TEZQBKY3TOAG6A/ref=cm_cr_getr_d_gw_btm?ie=UTF8,Quiet and does the job,5,5.0 out of 5 stars,"I use the heater to warm a small room that doesn't get enough central heat to warm sufficiently. This heater does exactly what I wanted, and it's so quiet I have to check the power light to see if it's running. I'll buy again if it lasts more than one season, which it probably will.",https://www.amazon.com/gp/customer-reviews/R1ZEZLICDE1732/ref=cm_cr_getr_d_rvw_ttl?ie=UTF8&ASIN=B07FFZRRB2,27-Jan-24,Color: White,Verified Purchase,,,,,2025-06-03T15:28:22.474Z,3,34.99,0,Quiet and does the job,"I use the heater to warm a small room that doesn't get enough central heat to warm sufficiently. This heater does exactly what I wanted, and it's so quiet I have to check the power light to see if it's running. I'll buy again if it lasts more than one season, which it probably will.",0.4215,0
R3QVQL4IIJQ44L,Roberta Terrell,https://www.amazon.com/gp/profile/amzn1.account.AFDOZTHE7WWNFUGWM7G62Z37NS3A/ref=cm_cr_getr_d_gw_btm?ie=UTF8,Relatively easy to use.,5,5.0 out of 5 stars,No problems,https://www.amazon.com/gp/customer-reviews/R3QVQL4IIJQ44L/ref=cm_cr_getr_d_rvw_ttl?ie=UTF8&ASIN=B07FFZRRB2,24-Jan-24,Color: White,Verified Purchase,,,,,2025-06-03T15:28:22.475Z,3,34.99,0,Relatively easy to use.,No problems,0.3089,0.4404
R1YG53FC3TO1J,greengirl,https://www.amazon.com/gp/profile/amzn1.account.AGVZWU44LD7QJ6OIPHSDJ3IEZPTQ/ref=cm_cr_getr_d_gw_btm?ie=UTF8,Only lasted 14 months,2,2.0 out of 5 stars,"I love this little guy. Heats up right away and puts out a lot of heat. The only thing is is that it’s not super quiet, not terrible but def sounds like a fan running.UPDATE: I had to change my review to 2 stars. It's been 14 months and it stopped working. Such a bummer. They don't make things to last anymore.",https://www.amazon.com/gp/customer-reviews/R1YG53FC3TO1J/ref=cm_cr_getr_d_rvw_ttl?ie=UTF8&ASIN=B07FFZRRB2,24-Jan-24,Color: White,Verified Purchase,,,,,2025-06-03T15:28:22.476Z,3,34.99,0,Only lasted 14 months,"I love this little guy. Heats up right away and puts out a lot of heat. The only thing is is that it’s not super quiet, not terrible but def sounds like a fan running.UPDATE: I had to change my review to 2 stars. It's been 14 months and it stopped working. Such a bummer. They don't make things to last anymore.",0.4125,0
R3I9JGRDAAWE53,ronald boggio,https://www.amazon.com/gp/profile/amzn1.account.AGDPQZERP5KL2DTZCT4FZZV72O5A/ref=cm_cr_getr_d_gw_btm?ie=UTF8,Warm,4,4.0 out of 5 stars,Gaming on time in good shape I recommend defeta equipment someone no,https://www.amazon.com/gp/customer-reviews/R3I9JGRDAAWE53/ref=cm_cr_getr_d_rvw_ttl?ie=UTF8&ASIN=B07FFZRRB2,18-Jan-24,Color: White,Verified Purchase,,,,,2025-06-03T15:28:22.476Z,3,34.99,0,Warm,Gaming on time in good shape I recommend defeta equipment someone no,0.4939,0.2263
R3EV5PUNJM446Y,zuus5,https://www.amazon.com/gp/profile/amzn1.account.AHNOOQVVBQUV26HIJO3NQW3LTLCA/ref=cm_cr_getr_d_gw_btm?ie=UTF8,Nice heater-until it died on the coldest day of the year.,3,3.0 out of 5 stars,This was a nice heater but it only lasted 3 years. I replaced it with a different brand. Hopefully the next one will last longer.,https://www.amazon.com/gp/customer-reviews/R3EV5PUNJM446Y/ref=cm_cr_getr_d_rvw_ttl?ie=UTF8&ASIN=B07FFZRRB2,17-Jan-24,Color: White,Verified Purchase,,,,,2025-06-03T15:28:31.738Z,3,34.99,0,Nice heater-until it died on the coldest day of the year.,This was a nice heater but it only lasted 3 years. I replaced it with a different brand. Hopefully the next one will last longer.,0.6652,-0.2023
R2ELY4XXYENZ5E,Just Me,https://www.amazon.com/gp/profile/amzn1.account.AEVRQDAL74QMFFTRAQ37TA4XREGQ/ref=cm_cr_getr_d_gw_btm?ie=UTF8,Had to lower rating.,2,2.0 out of 5 stars,"Well I originally dated this a 5 star. That was based on my first purchase. It lasted the average of 3 seasons before failing. Was a good heater and I was fine with it.The second one I bought as a spare failed within 1 year of original use. Technically it would still work but not safe. One day it just quit working, turned out to be a bad switch. First it would not come on, then it would not turn off when lifted or tiped. Sent to trash.That was the shortest lived space heater I ever had and I have been using them for 30 years. Too late to return.So 50 50 success gets 2 stars at best.",https://www.amazon.com/gp/customer-reviews/R2ELY4XXYENZ5E/ref=cm_cr_getr_d_rvw_ttl?ie=UTF8&ASIN=B07FFZRRB2,5-Jan-24,Color: White,Verified Purchase,,,,,2025-06-03T15:28:31.739Z,3,34.99,0,Had to lower rating.,"Well I originally dated this a 5 star. That was based on my first purchase. It lasted the average of 3 seasons before failing. Was a good heater and I was fine with it.The second one I bought as a spare failed within 1 year of original use. Technically it would still work but not safe. One day it just quit working, turned out to be a bad switch. First it would not come on, then it would not turn off when lifted or tiped. Sent to trash.That was the shortest lived space heater I ever had and I have been using them for 30 years. Too late to return.So 50 50 success gets 2 stars at best.",0.6418,-0.296
R13ES2SKGGOBYO,J. Martin,https://www.amazon.com/gp/profile/amzn1.account.AHJC5BCH2WPHJAEZAIWV22N43HJA/ref=cm_cr_getr_d_gw_btm?ie=UTF8,"Simple,compact, and effective",5,5.0 out of 5 stars,"No electronic digital unnecessary technology. Just a nice powerful ceramic heater with an effective fan,  an analog mechanical thermostat, and a tip-over switch. Everything you need and nothing you don't. I have three of them for use in my travel trailers.",https://www.amazon.com/gp/customer-reviews/R13ES2SKGGOBYO/ref=cm_cr_getr_d_rvw_ttl?ie=UTF8&ASIN=B07FFZRRB2,29-Dec-23,Color: White,Verified Purchase,,,,,2025-06-03T15:28:31.740Z,3,34.99,0,"Simple,compact, and effective","No electronic digital unnecessary technology. Just a nice powerful ceramic heater with an effective fan,  an analog mechanical thermostat, and a tip-over switch. Everything you need and nothing you don't. I have three of them for use in my travel trailers.",0.8316,0.4767
R17EWLXK9JQ8QF,punkin,https://www.amazon.com/gp/profile/amzn1.account.AH7DOE47RXWKSKNYSO4T7UU226EA/ref=cm_cr_getr_d_gw_btm?ie=UTF8,great little heater,5,5.0 out of 5 stars,Light weight with shut-off safety feature.,https://www.amazon.com/gp/customer-reviews/R17EWLXK9JQ8QF/ref=cm_cr_getr_d_rvw_ttl?ie=UTF8&ASIN=B07FFZRRB2,29-Dec-23,Color: White,Verified Purchase,,,,,2025-06-03T15:28:31.742Z,3,34.99,0,great little heater,Light weight with shut-off safety feature.,0.4215,0.6249
RV629PS8DP9TC,flutterby4x,https://www.amazon.com/gp/profile/amzn1.account.AEJ3N3QEKHIVHJEDPYBC2R7PM7WQ/ref=cm_cr_getr_d_gw_btm?ie=UTF8,Great little heater!,5,5.0 out of 5 stars,This is my second one of these heaters.  I like mine so much that I bought a second one as a gift for an elderly friend.  I use it daily in the winter and have for the last 3 winters.  I love that it heats up instantly and has a safety button on the bottom so that any slight tilt turns it off.  It does pretty well on energy consumption too.  Its size makes it easy to fit into any space where I want to be warm.,https://www.amazon.com/gp/customer-reviews/RV629PS8DP9TC/ref=cm_cr_getr_d_rvw_ttl?ie=UTF8&ASIN=B07FFZRRB2,26-Dec-23,Color: Black,Verified Purchase,2 people found this helpful,,,,2025-06-03T15:28:31.743Z,3,34.99,0,Great little heater!,This is my second one of these heaters.  I like mine so much that I bought a second one as a gift for an elderly friend.  I use it daily in the winter and have for the last 3 winters.  I love that it heats up instantly and has a safety button on the bottom so that any slight tilt turns it off.  It does pretty well on energy consumption too.  Its size makes it easy to fit into any space where I want to be warm.,0.981,0.6588
R10KPI57VN39X1,Williams,https://www.amazon.com/gp/profile/amzn1.account.AG5GWM4YW6O7S7CCBFCSANW67MTQ/ref=cm_cr_getr_d_gw_btm?ie=UTF8,All warm and cozy,5,5.0 out of 5 stars,I bought this product used. Its been almost 2 weeks and has been getting used almost daily. I believe it's worth it's New price still. It heats my 12x15 room up in no time. Strong blowing fan with good heat.,https://www.amazon.com/gp/customer-reviews/R10KPI57VN39X1/ref=cm_cr_getr_d_rvw_ttl?ie=UTF8&ASIN=B07FFZRRB2,14-Dec-23,Color: White,Verified Purchase,,,,,2025-06-03T15:28:31.743Z,3,34.99,0,All warm and cozy,I bought this product used. Its been almost 2 weeks and has been getting used almost daily. I believe it's worth it's New price still. It heats my 12x15 room up in no time. Strong blowing fan with good heat.,0.2955,0.2263
R2KFRV097BX9ES,MDizz,https://www.amazon.com/gp/profile/amzn1.account.AHSHNLAWFSBU4CBQXHG5LLTNRVAQ/ref=cm_cr_getr_d_gw_btm?ie=UTF8,Mine keeps shutting off,1,1.0 out of 5 stars,"This thing keeps shutting off on me and there is no way to get it to go back on until like 30 minutes later. I think I got a dud. No, I'm not an idiot and I know it is supposed to shut off after a certain temp but this thing doesn't change the room temp and shuts down anyway after a few minutes then I can't get it back on until like an hour later. I even set it to the lowest setting and it shuts down, then when I crank it up it still doesn't want to go. Trash.",https://www.amazon.com/gp/customer-reviews/R2KFRV097BX9ES/ref=cm_cr_getr_d_rvw_ttl?ie=UTF8&ASIN=B07FFZRRB2,12-Dec-23,Color: White,Verified Purchase,,,,,2025-06-03T15:28:31.744Z,3,34.99,0,Mine keeps shutting off,"This thing keeps shutting off on me and there is no way to get it to go back on until like 30 minutes later. I think I got a dud. No, I'm not an idiot and I know it is supposed to shut off after a certain temp but this thing doesn't change the room temp and shuts down anyway after a few minutes then I can't get it back on until like an hour later. I even set it to the lowest setting and it shuts down, then when I crank it up it still doesn't want to go. Trash.",0.1451,0
R12LSFGIOINNVE,Amazon Customer,https://www.amazon.com/gp/profile/amzn1.account.AHLFFUVMQNCYKKLTMKMLJNEQPH5Q/ref=cm_cr_getr_d_gw_btm?ie=UTF8,perfect for bathroom,5,5.0 out of 5 stars,bathroom,https://www.amazon.com/gp/customer-reviews/R12LSFGIOINNVE/ref=cm_cr_getr_d_rvw_ttl?ie=UTF8&ASIN=B07FFZRRB2,5-Dec-23,Color: White,Verified Purchase,,,,,2025-06-03T15:28:31.744Z,3,34.99,0,perfect for bathroom,bathroom,0,0.5719
R29AW9S7VPKETE,Ashley,https://www.amazon.com/gp/profile/amzn1.account.AGEAXXA2AQZ45MZNPEFAZUOIYUSQ/ref=cm_cr_getr_d_gw_btm?ie=UTF8,bummer,3,3.0 out of 5 stars,"I actually had this same space heater in my bathroom for 2+ years, but it crapped out this winter so I bought the same one again. Anyways this one I’ve had for a month and it’s developed this annoying clicking sound when in heat mode and it turns off every few minutes (I imagine it overheats and takes a break? Idk) and clicks back on eventually. Not only is that annoying but it’s an issue because it doesn’t make noise when it turns itself off so sometimes Ieave and forget to turn the switch off since I couldn’t tell it was actually on. Pretty bummed because the version of the same one I had before worked great.",https://www.amazon.com/gp/customer-reviews/R29AW9S7VPKETE/ref=cm_cr_getr_d_rvw_ttl?ie=UTF8&ASIN=B07FFZRRB2,3-Dec-23,Color: White,Verified Purchase,3 people found this helpful,,,,2025-06-03T15:28:31.745Z,3,34.99,0,bummer,"I actually had this same space heater in my bathroom for 2+ years, but it crapped out this winter so I bought the same one again. Anyways this one I’ve had for a month and it’s developed this annoying clicking sound when in heat mode and it turns off every few minutes (I imagine it overheats and takes a break? Idk) and clicks back on eventually. Not only is that annoying but it’s an issue because it doesn’t make noise when it turns itself off so sometimes Ieave and forget to turn the switch off since I couldn’t tell it was actually on. Pretty bummed because the version of the same one I had before worked great.",0.0676,-0.3818
R2BCSX0A9ZZZGS,Andrew Rodriguez,https://www.amazon.com/gp/profile/amzn1.account.AFRB7AAJYBMEWNC57TGSFA2GKDWQ/ref=cm_cr_getr_d_gw_btm?ie=UTF8,It's great but breaks out of nowhere,1,1.0 out of 5 stars,"Such a great lil machine, does what's its supposed too - up until it doesn't. Have bought this twice now, 1st time it ran until it randomly just stopped working one day. Reached out to company, they replaced it and sent me a new one. So now most recently it happened again. Beginning to not trust this brand.",https://www.amazon.com/gp/customer-reviews/R2BCSX0A9ZZZGS/ref=cm_cr_getr_d_rvw_ttl?ie=UTF8&ASIN=B07FFZRRB2,2-Dec-23,Color: White,Verified Purchase,2 people found this helpful,,,,2025-06-03T15:28:31.746Z,3,34.99,0,It's great but breaks out of nowhere,"Such a great lil machine, does what's its supposed too - up until it doesn't. Have bought this twice now, 1st time it ran until it randomly just stopped working one day. Reached out to company, they replaced it and sent me a new one. So now most recently it happened again. Beginning to not trust this brand.",0.2259,0.3716
R3TI2X0O6P7RJQ,fun,https://www.amazon.com/gp/profile/amzn1.account.AHP5AZOYVQQEQ4SBF7N3AOYJFVVQ/ref=cm_cr_getr_d_gw_btm?ie=UTF8,Small but mighty,5,5.0 out of 5 stars,Love it. Heats great.,https://www.amazon.com/gp/customer-reviews/R3TI2X0O6P7RJQ/ref=cm_cr_getr_d_rvw_ttl?ie=UTF8&ASIN=B07FFZRRB2,1-Dec-23,Color: Black,Verified Purchase,One person found this helpful,,,,2025-06-03T15:28:40.499Z,3,34.99,0,Small but mighty,Love it. Heats great.,0.8519,0
R2P30ZIG9N41R5,country bumpkin,https://www.amazon.com/gp/profile/amzn1.account.AHCUHPSDNFMIKXYSHAWTUPNAUNEA/ref=cm_cr_getr_d_gw_btm?ie=UTF8,"it was as advertised white, and described perfectly",5,5.0 out of 5 stars,"just what we wanted, seems to work well but not much use so far",https://www.amazon.com/gp/customer-reviews/R2P30ZIG9N41R5/ref=cm_cr_getr_d_rvw_ttl?ie=UTF8&ASIN=B07FFZRRB2,28-Nov-23,Color: White,Verified Purchase,,,,,2025-06-03T15:28:40.500Z,3,34.99,0,"it was as advertised white, and described perfectly","just what we wanted, seems to work well but not much use so far",0.1406,0.6369
R6T7YPD7OLLRY,Vicki Chandler,https://www.amazon.com/gp/profile/amzn1.account.AH5YC3T2KWDFFCH2SDR7MEIGB42A/ref=cm_cr_getr_d_gw_btm?ie=UTF8,Perfect for bathroom,5,5.0 out of 5 stars,"Heats good, small, adjustable",https://www.amazon.com/gp/customer-reviews/R6T7YPD7OLLRY/ref=cm_cr_getr_d_rvw_ttl?ie=UTF8&ASIN=B07FFZRRB2,26-Nov-23,Color: White,Verified Purchase,One person found this helpful,,,,2025-06-03T15:28:40.500Z,3,34.99,0,Perfect for bathroom,"Heats good, small, adjustable",0.4404,0.5719
